{
  "meta": {
    "schema_version": 1,
    "document_id": "DOC-INVESTOR-FINANCIAL-SUMMARY",
    "version": "0.1",
    "status": "research",
    "financial_model_document_id": "DOC-FINANCIAL-MODEL",
    "financial_model_content_state_sha256": "964ed09c82f3e872183c56ec79929762bce100259f2c0ad2d2749148dc3b3262",
    "financial_model_projection_sha256": "78b0085f7f26e1b19ae93967eb3cdf4d6c39592c003fbb02a9990874bbda5640",
    "summary_content_state_sha256": "3d0d7b6eadaa62beaadee6cb5212de7c758a7d5e7534b7d1847b192945584408"
  },
  "headline": {
    "scenario_id": "realistic",
    "scenario_name": "Реалистичный",
    "start_investment_rub": 45370380.74,
    "sales_per_month_rub": 10488600,
    "average_check_rub": 1165.4,
    "checks_per_day": 300,
    "ebitda_rub": 2413464.4,
    "ebitda_margin": 0.23010357912400128,
    "break_even_checks_per_day": 165.95,
    "free_cash_flow_rub": 2184509.8,
    "free_cash_flow_basis": "зрелый месяц",
    "payback_month": 23,
    "roi": 0.571107454591898,
    "irr": 0.6132655586273896,
    "npv_rub": 36701297.58,
    "discount_rate": 0.2,
    "year_1": {
      "sales_rub": 114582710.7,
      "ebitda_rub": 22664361.54,
      "ebitda_margin": 0.19779913916803504,
      "free_cash_flow_rub": 20313011.06
    },
    "mature_year": {
      "sales_rub": 125758314,
      "ebitda_rub": 28654446.36,
      "ebitda_margin": 0.22785329612481922,
      "free_cash_flow_rub": 25911362.66
    },
    "personnel": {
      "calculated_rub": 2396938.28,
      "protected_floor_rub": 2831922,
      "applied_rub": 2831922,
      "protected_applied": true
    },
    "drivers": {
      "checks_per_day": 300,
      "average_check_rub": 1165.4,
      "sales_per_month_rub": 10488600,
      "gross_margin": 0.6641645977537517,
      "rent_per_month_rub": 350000,
      "headcount": 16,
      "break_even_checks_per_day": 165.95
    }
  },
  "scenario_comparison": [
    {
      "id": "pessimistic",
      "name": "Пессимистичный",
      "checks_per_day": 200,
      "sales_per_month_rub": 6992400,
      "ebitda_rub": 1071180.35,
      "ebitda_margin": 0.15319208712316237,
      "free_cash_flow_rub": 968571.34,
      "break_even_checks_per_day": 151.08,
      "payback_month": 48,
      "roi": 0.2627890741095091,
      "irr": 0.10289613823565258,
      "npv_rub": -8045583.84,
      "start_investment_rub": 42940761.74,
      "calculated_staffing_labor_rub": 2092577.25,
      "protected_labor_floor_rub": 1887948,
      "protected_labor_applied": false,
      "personnel_rub": 2092577.25,
      "headcount": 14,
      "marketing_rub": 317817.6,
      "household_rub": 83333.33,
      "year_1": {
        "sales_rub": 76388473.8,
        "ebitda_rub": 7364521.29,
        "ebitda_margin": 0.09640880258037045,
        "free_cash_flow_rub": 6207914.59
      },
      "mature_year": {
        "sales_rub": 83838876,
        "ebitda_rub": 12557963.31,
        "ebitda_margin": 0.14978687584027248,
        "free_cash_flow_rub": 11284363.02
      }
    },
    {
      "id": "realistic",
      "name": "Реалистичный",
      "checks_per_day": 300,
      "sales_per_month_rub": 10488600,
      "ebitda_rub": 2413464.4,
      "ebitda_margin": 0.23010357912400128,
      "free_cash_flow_rub": 2184509.8,
      "break_even_checks_per_day": 165.95,
      "payback_month": 23,
      "roi": 0.571107454591898,
      "irr": 0.6132655586273896,
      "npv_rub": 36701297.58,
      "start_investment_rub": 45370380.74,
      "calculated_staffing_labor_rub": 2396938.28,
      "protected_labor_floor_rub": 2831922,
      "protected_labor_applied": true,
      "personnel_rub": 2831922,
      "headcount": 16,
      "marketing_rub": 401726.4,
      "household_rub": 100000,
      "year_1": {
        "sales_rub": 114582710.7,
        "ebitda_rub": 22664361.54,
        "ebitda_margin": 0.19779913916803504,
        "free_cash_flow_rub": 20313011.06
      },
      "mature_year": {
        "sales_rub": 125758314,
        "ebitda_rub": 28654446.36,
        "ebitda_margin": 0.22785329612481922,
        "free_cash_flow_rub": 25911362.66
      }
    },
    {
      "id": "optimistic",
      "name": "Оптимистичный",
      "checks_per_day": 450,
      "sales_per_month_rub": 15732900,
      "ebitda_rub": 4119946.6,
      "ebitda_margin": 0.26186822518416814,
      "free_cash_flow_rub": 3707937.84,
      "break_even_checks_per_day": 193.22,
      "payback_month": 15,
      "roi": 0.8957430849561592,
      "irr": 1.1962123382587664,
      "npv_rub": 92021328.42,
      "start_investment_rub": 49624292.36,
      "calculated_staffing_labor_rub": 2955060.35,
      "protected_labor_floor_rub": 4247883,
      "protected_labor_applied": true,
      "personnel_rub": 4247883,
      "headcount": 20,
      "marketing_rub": 527589.6,
      "household_rub": 125000,
      "year_1": {
        "sales_rub": 171874066.05,
        "ebitda_rub": 42532660.52,
        "ebitda_margin": 0.24746409680926962,
        "free_cash_flow_rub": 38300149.72
      },
      "mature_year": {
        "sales_rub": 188637471,
        "ebitda_rub": 49388164.75,
        "ebitda_margin": 0.2618152400378608,
        "free_cash_flow_rub": 44450616.73
      }
    }
  ],
  "income_statement": {
    "sales_rub": 10488600,
    "cogs_rub": 3522443.2,
    "cogs": {
      "raw_materials_rub": 3146580,
      "waste_rub": 125863.2,
      "packaging_rub": 250000
    },
    "gross_profit_rub": 6966156.8,
    "gross_margin": 0.6641645977537517,
    "expense_groups": {
      "personnel_rub": 2831922,
      "premises_rub": 350000,
      "acquiring_rub": 209772,
      "utilities_rub": 200000,
      "marketing_rub": 401726.4,
      "operations_rub": 152000,
      "administrative_rub": 31000,
      "administrative_reserve_rub": 209772,
      "household_rub": 100000,
      "other_rub": 66500
    },
    "marketing_formula": {
      "fixed_amount_rub": 150000,
      "rate_of_net_revenue": 0.024,
      "ramp_up_floor_rub": 400000,
      "ramp_up_floor_months": 6
    },
    "marketing_structure_reference": [
      {
        "id": "MARKETING_SMM",
        "name": "SMM / ведение",
        "amount_rub": 50000
      },
      {
        "id": "MARKETING_BLOGGERS",
        "name": "Блогеры / инфлюенсеры / гастроканалы",
        "amount_rub": 150000
      },
      {
        "id": "MARKETING_PERFORMANCE",
        "name": "Performance / геореклама / продвижение",
        "amount_rub": 75000
      },
      {
        "id": "MARKETING_CONTENT",
        "name": "Производство фото / видео / контента",
        "amount_rub": 40000
      },
      {
        "id": "MARKETING_CRM",
        "name": "CRM / акции / возврат гостей",
        "amount_rub": 25000
      },
      {
        "id": "MARKETING_MERCH",
        "name": "Мерч / подарки / специальные промоматериалы",
        "amount_rub": 25000
      },
      {
        "id": "MARKETING_PARTNERSHIPS",
        "name": "Локальные партнёрства / события / PR",
        "amount_rub": 20000
      },
      {
        "id": "MARKETING_TESTING",
        "name": "Резерв тестирования каналов",
        "amount_rub": 15000
      }
    ],
    "household_formula": {
      "fixed_amount_rub": 50000,
      "variable_amount_rub": 50000,
      "baseline_checks_per_day": 300
    },
    "operations_detail": {
      "EQUIPMENT_SERVICE": 100000,
      "VENT_GREASE": 15000,
      "PEST": 6000,
      "SECURITY_MONITORING": 4000,
      "UNIFORM_RENEWAL": 15000,
      "MEDICAL": 5000,
      "MUSIC_RIGHTS": 7000
    },
    "administrative_detail": {
      "ACCOUNTING": 25000,
      "YUMA": 6000,
      "BANKING": 0
    },
    "other_detail": {
      "OTHER": 66500
    },
    "ebitda_rub": 2413464.4,
    "ebitda_margin": 0.23010357912400128,
    "depreciation_rub": 208616.15,
    "tax_rub": 214644.61,
    "net_operating_result_rub": 1990203.64,
    "maintenance_capex_rub": 14309.98,
    "free_cash_flow_rub": 2184509.8
  },
  "investments": {
    "breakdown": [
      {
        "key": "equipment",
        "group": "creation",
        "name": "Оборудование",
        "amount_rub": 5298993.33
      },
      {
        "key": "furniture",
        "group": "creation",
        "name": "Мебель",
        "amount_rub": 425000
      },
      {
        "key": "preparation",
        "group": "creation",
        "name": "Подготовка помещения",
        "amount_rub": 11000000
      },
      {
        "key": "video",
        "group": "creation",
        "name": "Видеонаблюдение",
        "amount_rub": 70000
      },
      {
        "key": "alarm",
        "group": "creation",
        "name": "Охранная сигнализация",
        "amount_rub": 35000
      },
      {
        "key": "uniform",
        "group": "launch",
        "name": "Первичная форма",
        "amount_rub": 180000
      },
      {
        "key": "launch_marketing",
        "group": "launch",
        "name": "Маркетинг запуска",
        "amount_rub": 700000
      },
      {
        "key": "contingency",
        "group": "launch",
        "name": "Резерв запуска",
        "amount_rub": 1672399.33
      },
      {
        "key": "inventory",
        "group": "tied",
        "name": "Первоначальный товарный запас",
        "amount_rub": 1000000
      },
      {
        "key": "prepaid_rent",
        "group": "tied",
        "name": "Предоплата аренды на 12 месяцев",
        "amount_rub": 4200000
      },
      {
        "key": "deposit",
        "group": "tied",
        "name": "Обеспечительный платёж",
        "amount_rub": 700000
      },
      {
        "key": "operating_reserve",
        "group": "reserve",
        "name": "Операционный запас",
        "amount_rub": 20088988.08
      }
    ],
    "groups": [
      {
        "key": "creation",
        "name": "Создание объекта",
        "note": "Оборудование, мебель и подготовка помещения.",
        "amount_rub": 16828993.33,
        "items": [
          {
            "key": "equipment",
            "name": "Оборудование",
            "amount_rub": 5298993.33
          },
          {
            "key": "furniture",
            "name": "Мебель",